{
  "schemaVersion": "1.0.0",
  "requestId": "22222222-2222-4222-8222-222222222222",
  "runId": "11111111-1111-4111-8111-111111111111",
  "deployment": {
    "deploymentId": "33333333-3333-4333-8333-333333333333",
    "workflowKey": "wf-support-bot",
    "workflowRevision": "rev-7",
    "wrapperRevision": "wrapper-3",
    "contractVersion": "1.0.0",
    "declaredModelProvider": "anthropic",
    "declaredModel": "claude-sonnet-5"
  },
  "botId": "44444444-4444-4444-8444-444444444444",
  "channelId": "55555555-5555-4555-8555-555555555555",
  "threadId": "66666666-6666-4666-8666-666666666666",
  "rootMessageId": "77777777-7777-4777-8777-777777777777",
  "trigger": {
    "kind": "MESSAGE",
    "messageId": "88888888-8888-4888-8888-888888888888",
    "messageRevisionId": "99999999-9999-4999-8999-999999999999"
  },
  "source": {
    "actorId": "aaaaaaaa-aaaa-4aaa-8aaa-aaaaaaaaaaaa",
    "userId": "bbbbbbbb-bbbb-4bbb-8bbb-bbbbbbbbbbbb",
    "origin": "USER_UI"
  },
  "requestTime": "2026-07-13T12:00:00.000Z",
  "timezone": "Asia/Taipei",
  "locale": "zh-TW",
  "contextManifest": {
    "schemaVersion": "1.0.0",
    "threadId": "66666666-6666-4666-8666-666666666666",
    "rootMessageId": "77777777-7777-4777-8777-777777777777",
    "cutoffMessageId": "88888888-8888-4888-8888-888888888888",
    "messageRefs": [
      {
        "messageId": "77777777-7777-4777-8777-777777777777",
        "revisionId": "ffffffff-ffff-4fff-8fff-ffffffffffff",
        "sequence": 0
      },
      {
        "messageId": "88888888-8888-4888-8888-888888888888",
        "revisionId": "99999999-9999-4999-8999-999999999999",
        "sequence": 1
      }
    ],
    "summaryRevision": null,
    "summarizedThroughMessageId": null,
    "attachmentRefs": [],
    "locale": "zh-TW",
    "timezone": "Asia/Taipei",
    "generatedAt": "2026-07-13T12:00:00.000Z",
    "manifestHash": "aaaaaaaaaaaaaaaaaaaaaaaaaaaaaaaaaaaaaaaaaaaaaaaaaaaaaaaaaaaaaaaa"
  },
  "contextHash": "aaaaaaaaaaaaaaaaaaaaaaaaaaaaaaaaaaaaaaaaaaaaaaaaaaaaaaaaaaaaaaaa",
  "attachments": [
    {
      "schemaVersion": "1.0.0",
      "attachmentId": "cccccccc-cccc-4ccc-8ccc-cccccccccccc",
      "runId": "11111111-1111-4111-8111-111111111111",
      "direction": "INPUT",
      "status": "READY",
      "mimeType": "image/png",
      "sizeBytes": 1024,
      "checksumSha256": "bbbbbbbbbbbbbbbbbbbbbbbbbbbbbbbbbbbbbbbbbbbbbbbbbbbbbbbbbbbbbbbb",
      "capability": "attachment-cap-0123456789abcdef",
      "expiresAt": "2026-07-13T12:10:00.000Z",
      "fileName": "screenshot.png"
    }
  ],
  "capabilities": {
    "claim": "claim-cap-0123456789abcdef",
    "completion": "completion-cap-0123456789abcdef"
  },
  "deadlineAt": "2026-07-13T12:10:00.000Z"
}
